{
  "$schema": "https://json-schema.org/draft/2020-12/schema",
  "$id": "https://unpkg.com/scip-query/docs/schemas/suppression-record.schema.json",
  "title": "scip-query suppression record v2",
  "description": "A repository-owned policy decision stored as one file under .scipquery/suppressions/.",
  "type": "object",
  "required": ["kind", "schemaVersion", "suppressionIdentity", "writer", "reason", "createdAt", "decision"],
  "properties": {
    "kind": { "const": "scip-query-suppression" },
    "schemaVersion": { "const": 2 },
    "suppressionIdentity": { "type": "string", "minLength": 1 },
    "writer": {
      "type": "object",
      "required": ["tool", "version"],
      "properties": {
        "tool": { "const": "scip-query" },
        "version": { "type": "string", "minLength": 1 }
      },
      "additionalProperties": true
    },
    "id": { "type": "string", "minLength": 1 },
    "check": { "type": "string", "minLength": 1 },
    "file": { "type": "string", "minLength": 1 },
    "reason": { "type": "string", "minLength": 1 },
    "decision": {
      "type": "object",
      "required": ["kind", "reasonCode", "decidedBy", "policyVersion", "evidence", "invalidateOn"],
      "properties": {
        "kind": { "const": "automated-adjudication" },
        "reasonCode": {
          "enum": [
            "entry-surface",
            "generated-code",
            "compatibility-shim",
            "reflection-or-registration",
            "test-fixture",
            "intentional-twin",
            "historical-coupling-ended",
            "detector-counterexample"
          ]
        },
        "decidedBy": { "enum": ["agent", "human"] },
        "policyVersion": { "const": 1 },
        "observation": { "$ref": "./observation-receipt.schema.json" },
        "evidence": {
          "type": "array",
          "minItems": 1,
          "items": {
            "type": "object",
            "required": ["kind", "referent", "claim"],
            "properties": {
              "kind": { "enum": ["source", "config", "test", "graph"] },
              "referent": { "type": "string", "minLength": 1 },
              "claim": { "type": "string", "minLength": 1 },
              "contentHash": { "type": "string", "pattern": "^[a-f0-9]{64}$" },
              "generation": { "type": "string", "minLength": 1 }
            },
            "additionalProperties": true
          }
        },
        "invalidateOn": {
          "type": "object",
          "required": ["targetContentChange", "detectorMajorChange"],
          "properties": {
            "targetContentChange": { "type": "boolean" },
            "detectorMajorChange": { "type": "boolean" }
          },
          "additionalProperties": true
        }
      },
      "additionalProperties": true
    },
    "expiresAt": { "type": "string", "format": "date-time" },
    "createdAt": { "type": "string", "format": "date-time" },
    "updatedAt": { "type": "string", "format": "date-time" }
  },
  "anyOf": [{ "required": ["id"] }, { "required": ["check"] }],
  "additionalProperties": true
}
