{
  "kind": "scip-query-suppression",
  "suppressionIdentity": "SQ5DC1C881FD92",
  "writer": {
    "tool": "scip-query",
    "version": "0.20.0"
  },
  "id": "SQ5DC1C881FD92",
  "reason": "The watcher already resets its existing timer on every event; this slice changes only the resolved default and adds boundary tests for that existing state machine.",
  "createdAt": "2026-07-29T19:51:15.997Z",
  "schemaVersion": 2,
  "decision": {
    "kind": "automated-adjudication",
    "reasonCode": "detector-counterexample",
    "decidedBy": "agent",
    "policyVersion": 1,
    "observation": {
      "schemaVersion": 1,
      "authorityKind": "index-worktree",
      "observedAt": "2026-07-29T19:51:15.996Z",
      "projectIdentity": "178a22f2ce5800603672d10b597d4cf97078e596c64e2eb0293681604557bda7",
      "index": {
        "generationIdentity": "03c192dd966587ee098d123ebb3c5c95d01401d79420f048f44929dd4b07587f",
        "source": "immutable",
        "alignment": "not-certified"
      },
      "worktree": {
        "identity": "fd264287aeaf62ae2efce025ab4e17e1a26e4075573e0a4ef00f71d965ed04c3",
        "clean": false,
        "headCommit": "8abc8a6758620ab84c553182847b5ec0bd59309b",
        "treeOid": "1506a7bbfc71d853de3866cbc95758c8ebbb8611"
      }
    },
    "evidence": [
      {
        "kind": "source",
        "referent": "src/runtime/config.ts",
        "claim": "The watcher already resets its existing timer on every event; this slice changes only the resolved default and adds boundary tests for that existing state machine.",
        "contentHash": "fa1704ab948e4c58aa328c08dd18be1c2bb54b57b735e476f234bb57ab40da20"
      },
      {
        "kind": "test",
        "referent": "tests/runtime/watch.test.ts",
        "claim": "The watcher already resets its existing timer on every event; this slice changes only the resolved default and adds boundary tests for that existing state machine.",
        "contentHash": "4f540b4b8e41736f299a098237ff833d8699c3e23431c9bca6973c82c7fbcf82"
      }
    ],
    "invalidateOn": {
      "targetContentChange": true,
      "detectorMajorChange": true
    }
  }
}
