{
  "kind": "scip-query-suppression",
  "suppressionIdentity": "SQ2C72AFFB9547",
  "writer": {
    "tool": "scip-query",
    "version": "0.20.0"
  },
  "id": "SQ2C72AFFB9547",
  "reason": "COMMAND_REFERENCE is generated from command descriptions and options, neither of which changed; operation-role metadata is generated into the agent-contract catalog, which this slice updated and CLI contract tests compare to the generator.",
  "createdAt": "2026-07-31T01:38:34.652Z",
  "updatedAt": "2026-07-31T01:44:44.189Z",
  "schemaVersion": 2,
  "decision": {
    "kind": "automated-adjudication",
    "reasonCode": "generated-code",
    "decidedBy": "agent",
    "policyVersion": 1,
    "observation": {
      "schemaVersion": 1,
      "authorityKind": "index-worktree",
      "observedAt": "2026-07-31T01:44:44.188Z",
      "projectIdentity": "178a22f2ce5800603672d10b597d4cf97078e596c64e2eb0293681604557bda7",
      "index": {
        "generationIdentity": "22ac90beda11aeb7c84290b4a0c2339b17e17596a402329d4375bebfc87ef6ee",
        "source": "immutable",
        "alignment": "not-certified"
      },
      "worktree": {
        "identity": "5c4aa59381876e7771eb9f47a9bdbedcc225dfb4724b6cdd0af29da0aef35529",
        "clean": false,
        "headCommit": "540c7e1ee30f5da26b85eabd508f9b2f64c09089",
        "treeOid": "e53a2de842482db3385cf8211291c9d86cbf3d07"
      }
    },
    "evidence": [
      {
        "kind": "source",
        "referent": "scripts/render-command-reference.ts",
        "claim": "COMMAND_REFERENCE is generated from command descriptions and options, neither of which changed; operation-role metadata is generated into the agent-contract catalog, which this slice updated and CLI contract tests compare to the generator.",
        "contentHash": "0601b870684f0df66c96728675af1b35c00e6e2de3d1f3c3eb7286be953a364a"
      },
      {
        "kind": "source",
        "referent": "skills/_shared/references/agent-contract-catalog.md",
        "claim": "COMMAND_REFERENCE is generated from command descriptions and options, neither of which changed; operation-role metadata is generated into the agent-contract catalog, which this slice updated and CLI contract tests compare to the generator.",
        "contentHash": "614e9d768c4d70e07f8812fd03b9d94f06d8f297f643822cf587658b6d90f9fa"
      },
      {
        "kind": "test",
        "referent": "tests/runtime/cli-contract.test.ts",
        "claim": "COMMAND_REFERENCE is generated from command descriptions and options, neither of which changed; operation-role metadata is generated into the agent-contract catalog, which this slice updated and CLI contract tests compare to the generator.",
        "contentHash": "a1fa0ae004951087efb73533979c0e6a44f220817454ac6811e374c98cb57951"
      }
    ],
    "invalidateOn": {
      "targetContentChange": true,
      "detectorMajorChange": true
    }
  }
}
