{
  "kind": "scip-query-suppression",
  "suppressionIdentity": "SQA2CA81849DA0",
  "writer": {
    "tool": "scip-query",
    "version": "0.20.0"
  },
  "id": "SQA2CA81849DA0",
  "reason": "This slice adds an internal collaboration-domain setup step inside runProjectSetup. command-handlers still delegates the same parsed setup options and renders the same ProjectSetupReport, so the handler contract requires no coordination edit.",
  "createdAt": "2026-07-31T02:21:35.568Z",
  "schemaVersion": 2,
  "decision": {
    "kind": "automated-adjudication",
    "reasonCode": "historical-coupling-ended",
    "decidedBy": "agent",
    "policyVersion": 1,
    "observation": {
      "schemaVersion": 2,
      "observedAt": "2026-07-31T02:21:35.565Z",
      "facts": {
        "collaborationDomain": {
          "schemaVersion": 1,
          "canonicalizationVersion": 1,
          "hashAlgorithm": "sha256",
          "projection": {
            "name": "scip-query:collaboration-domain",
            "version": 1
          },
          "digest": "65fa7070a947c694f38de6708f2444d2bc2642785dcdb898d24a0401b41fb3c3"
        },
        "workspaceInstance": {
          "schemaVersion": 1,
          "canonicalizationVersion": 1,
          "hashAlgorithm": "sha256",
          "projection": {
            "name": "scip-query:workspace-instance",
            "version": 1
          },
          "digest": "f53b738aebdbca65df7f5d79a4bfc01cb854528c2a00705171682a625937c0c4"
        },
        "index": {
          "generation": {
            "schemaVersion": 1,
            "canonicalizationVersion": 1,
            "hashAlgorithm": "sha256",
            "projection": {
              "name": "scip-query:index-generation",
              "version": 1
            },
            "digest": "b75443e4cbaa0c921617f5606054df7fbed0af8d10eaa2119788cf3046b5fcdc"
          },
          "source": "immutable"
        }
      },
      "observedSources": [
        {
          "kind": "index-generation",
          "identity": {
            "schemaVersion": 1,
            "canonicalizationVersion": 1,
            "hashAlgorithm": "sha256",
            "projection": {
              "name": "scip-query:index-generation",
              "version": 1
            },
            "digest": "b75443e4cbaa0c921617f5606054df7fbed0af8d10eaa2119788cf3046b5fcdc"
          }
        },
        {
          "kind": "live-workspace",
          "identity": {
            "schemaVersion": 1,
            "canonicalizationVersion": 1,
            "hashAlgorithm": "sha256",
            "projection": {
              "name": "scip-query:workspace-instance",
              "version": 1
            },
            "digest": "f53b738aebdbca65df7f5d79a4bfc01cb854528c2a00705171682a625937c0c4"
          }
        }
      ],
      "stabilityProofs": [
        {
          "source": "index-generation",
          "kind": "immutable"
        },
        {
          "source": "live-workspace",
          "kind": "not-established"
        }
      ],
      "diagnostics": {
        "clean": false,
        "headCommit": "a1a69a3e4478370402fe4f3a86bbfefa0a73d386",
        "treeOid": "2021414b0e11305fa2dcde17a01aafeab658b76e"
      }
    },
    "evidence": [
      {
        "kind": "source",
        "referent": "src/runtime/project-setup.ts",
        "claim": "This slice adds an internal collaboration-domain setup step inside runProjectSetup. command-handlers still delegates the same parsed setup options and renders the same ProjectSetupReport, so the handler contract requires no coordination edit.",
        "contentHash": "4833f7a522cc253dd8b0b501b7021a60b5d462cbe80d938458985465f40879ca"
      },
      {
        "kind": "source",
        "referent": "src/runtime/commands/command-handlers.ts",
        "claim": "This slice adds an internal collaboration-domain setup step inside runProjectSetup. command-handlers still delegates the same parsed setup options and renders the same ProjectSetupReport, so the handler contract requires no coordination edit.",
        "contentHash": "6048e9d84c6c9b4179456cd8d27d7ff91a5884c9b42f2823d88b5f40239b986c"
      },
      {
        "kind": "test",
        "referent": "tests/runtime/project-setup.test.ts",
        "claim": "This slice adds an internal collaboration-domain setup step inside runProjectSetup. command-handlers still delegates the same parsed setup options and renders the same ProjectSetupReport, so the handler contract requires no coordination edit.",
        "contentHash": "7879ef5bd14fb8da462a007e79fc064eba79667b0483e2bec01bb55cb8766c57"
      }
    ],
    "invalidateOn": {
      "targetContentChange": true,
      "detectorMajorChange": true
    }
  }
}
