{
  "kind": "scip-query-suppression",
  "suppressionIdentity": "SQA94DC3F07D49",
  "writer": {
    "tool": "scip-query",
    "version": "0.20.0"
  },
  "id": "SQA94DC3F07D49",
  "reason": "The generated command reference records option names but not option help text, so regeneration correctly produces no diff for this debounce-description change; README documents the new default.",
  "createdAt": "2026-07-29T19:05:27.242Z",
  "updatedAt": "2026-07-29T19:51:15.369Z",
  "schemaVersion": 2,
  "decision": {
    "kind": "automated-adjudication",
    "reasonCode": "detector-counterexample",
    "decidedBy": "agent",
    "policyVersion": 1,
    "observation": {
      "schemaVersion": 1,
      "authorityKind": "index-worktree",
      "observedAt": "2026-07-29T19:51:15.368Z",
      "projectIdentity": "178a22f2ce5800603672d10b597d4cf97078e596c64e2eb0293681604557bda7",
      "index": {
        "generationIdentity": "03c192dd966587ee098d123ebb3c5c95d01401d79420f048f44929dd4b07587f",
        "source": "immutable",
        "alignment": "not-certified"
      },
      "worktree": {
        "identity": "9e443c4c760fc58fe6c2ba6d6a0d7380b6ca8fcce6ad33f3f16bc0f1506910c5",
        "clean": false,
        "headCommit": "8abc8a6758620ab84c553182847b5ec0bd59309b",
        "treeOid": "1506a7bbfc71d853de3866cbc95758c8ebbb8611"
      }
    },
    "evidence": [
      {
        "kind": "source",
        "referent": "scripts/render-command-reference.ts",
        "claim": "The generated command reference records option names but not option help text, so regeneration correctly produces no diff for this debounce-description change; README documents the new default.",
        "contentHash": "5959cfc2aee64441cdb4f57b076fce8bf631f153968e0046fd5f9f09b58a0297"
      },
      {
        "kind": "test",
        "referent": "tests/scripts/render-command-reference.test.ts",
        "claim": "The generated command reference records option names but not option help text, so regeneration correctly produces no diff for this debounce-description change; README documents the new default.",
        "contentHash": "5da4f1d1cbd2c7f8742bf4535b20cefa8620fc95746c2fd34e989b42fcf426a0"
      },
      {
        "kind": "source",
        "referent": "README.md",
        "claim": "The generated command reference records option names but not option help text, so regeneration correctly produces no diff for this debounce-description change; README documents the new default.",
        "contentHash": "acc107552ae7710d67f3019923647e1c025a7d9772a702bed70cc49e3d2fc81e"
      }
    ],
    "invalidateOn": {
      "targetContentChange": true,
      "detectorMajorChange": true
    }
  }
}
