{
  "kind": "scip-query-suppression",
  "suppressionIdentity": "SQ8AAEDA832021",
  "writer": {
    "tool": "scip-query",
    "version": "0.20.0"
  },
  "id": "SQ8AAEDA832021",
  "check": "echo",
  "file": "src/domain/residue.ts",
  "reason": "The exact-body score is a normalization counterexample: residueObservationId creates a versioned, canonical SQR record identity from a residue referent, while fileDependencyGraphCacheKey creates an unversioned disposable cache selector from graph modes. Sharing either function or a generic wrapper would erase the record namespace and contract-version boundary without consolidating a real policy.",
  "createdAt": "2026-07-31T09:34:27.369Z",
  "schemaVersion": 2,
  "decision": {
    "kind": "automated-adjudication",
    "reasonCode": "detector-counterexample",
    "decidedBy": "agent",
    "policyVersion": 1,
    "observation": {
      "schemaVersion": 2,
      "observedAt": "2026-07-31T09:34:27.362Z",
      "facts": {
        "collaborationDomain": {
          "schemaVersion": 1,
          "canonicalizationVersion": 1,
          "hashAlgorithm": "sha256",
          "projection": {
            "name": "scip-query:collaboration-domain",
            "version": 1
          },
          "digest": "65fa7070a947c694f38de6708f2444d2bc2642785dcdb898d24a0401b41fb3c3"
        },
        "workspaceInstance": {
          "schemaVersion": 1,
          "canonicalizationVersion": 1,
          "hashAlgorithm": "sha256",
          "projection": {
            "name": "scip-query:workspace-instance",
            "version": 1
          },
          "digest": "f53b738aebdbca65df7f5d79a4bfc01cb854528c2a00705171682a625937c0c4"
        },
        "wholeContent": {
          "schemaVersion": 1,
          "canonicalizationVersion": 1,
          "hashAlgorithm": "sha256",
          "projection": {
            "name": "scip-query:repository-content",
            "version": 1
          },
          "digest": "dff94eef09ec1b6c7d0bcccee3568a6512c2afc154a42f12170739910adce29a"
        },
        "relevantInputs": [
          {
            "subject": "scip-query:index-inputs",
            "identity": {
              "schemaVersion": 1,
              "canonicalizationVersion": 1,
              "hashAlgorithm": "sha256",
              "projection": {
                "name": "scip-query:index-inputs",
                "version": 2
              },
              "digest": "3d7d647378cacfbadc4942ebd0054d7954884d96569ac306357cbafa2e01e5ec"
            }
          }
        ],
        "index": {
          "generation": {
            "schemaVersion": 1,
            "canonicalizationVersion": 1,
            "hashAlgorithm": "sha256",
            "projection": {
              "name": "scip-query:index-generation",
              "version": 1
            },
            "digest": "0faf6fdae33eeb083e0526d548aa000311d29dead3039c79584955743bbd6d7e"
          },
          "inputs": {
            "schemaVersion": 1,
            "canonicalizationVersion": 1,
            "hashAlgorithm": "sha256",
            "projection": {
              "name": "scip-query:index-inputs",
              "version": 2
            },
            "digest": "3d7d647378cacfbadc4942ebd0054d7954884d96569ac306357cbafa2e01e5ec"
          },
          "source": "immutable"
        }
      },
      "observedSources": [
        {
          "kind": "index-generation",
          "identity": {
            "schemaVersion": 1,
            "canonicalizationVersion": 1,
            "hashAlgorithm": "sha256",
            "projection": {
              "name": "scip-query:index-generation",
              "version": 1
            },
            "digest": "0faf6fdae33eeb083e0526d548aa000311d29dead3039c79584955743bbd6d7e"
          }
        },
        {
          "kind": "repository-snapshot",
          "identity": {
            "schemaVersion": 1,
            "canonicalizationVersion": 1,
            "hashAlgorithm": "sha256",
            "projection": {
              "name": "scip-query:repository-content",
              "version": 1
            },
            "digest": "dff94eef09ec1b6c7d0bcccee3568a6512c2afc154a42f12170739910adce29a"
          }
        }
      ],
      "stabilityProofs": [
        {
          "source": "index-generation",
          "kind": "immutable"
        },
        {
          "source": "repository-snapshot",
          "kind": "fixed-snapshot"
        }
      ],
      "diagnostics": {
        "clean": false,
        "headCommit": "77e36a087b00cafddb2e146590d860e9e53c433f",
        "treeOid": "8766afaf8064029bd9f0e8b6cfd57a24a55be80d"
      }
    },
    "evidence": [
      {
        "kind": "source",
        "referent": "src/domain/residue.ts",
        "claim": "The exact-body score is a normalization counterexample: residueObservationId creates a versioned, canonical SQR record identity from a residue referent, while fileDependencyGraphCacheKey creates an unversioned disposable cache selector from graph modes. Sharing either function or a generic wrapper would erase the record namespace and contract-version boundary without consolidating a real policy.",
        "contentHash": "63573c44e7bfdee831e8a2b82103b11b61e741645dc486ea4c1b717c0c27304d"
      },
      {
        "kind": "source",
        "referent": "src/symbols/graph/file-dep-graph.ts",
        "claim": "The exact-body score is a normalization counterexample: residueObservationId creates a versioned, canonical SQR record identity from a residue referent, while fileDependencyGraphCacheKey creates an unversioned disposable cache selector from graph modes. Sharing either function or a generic wrapper would erase the record namespace and contract-version boundary without consolidating a real policy.",
        "contentHash": "89015964446554e1142fe3010c2a0bd4dc5dd9bc3213b9aed51f12afad94fab5"
      },
      {
        "kind": "test",
        "referent": "tests/domain/residue.test.ts",
        "claim": "The exact-body score is a normalization counterexample: residueObservationId creates a versioned, canonical SQR record identity from a residue referent, while fileDependencyGraphCacheKey creates an unversioned disposable cache selector from graph modes. Sharing either function or a generic wrapper would erase the record namespace and contract-version boundary without consolidating a real policy.",
        "contentHash": "d87f4caa60eb3d4826c07b737d007dc50e79f1db750ba655d670e73fd004609e"
      },
      {
        "kind": "graph",
        "referent": "scip-query code residueObservationId",
        "claim": "The exact-body score is a normalization counterexample: residueObservationId creates a versioned, canonical SQR record identity from a residue referent, while fileDependencyGraphCacheKey creates an unversioned disposable cache selector from graph modes. Sharing either function or a generic wrapper would erase the record namespace and contract-version boundary without consolidating a real policy."
      },
      {
        "kind": "graph",
        "referent": "scip-query code fileDependencyGraphCacheKey",
        "claim": "The exact-body score is a normalization counterexample: residueObservationId creates a versioned, canonical SQR record identity from a residue referent, while fileDependencyGraphCacheKey creates an unversioned disposable cache selector from graph modes. Sharing either function or a generic wrapper would erase the record namespace and contract-version boundary without consolidating a real policy."
      }
    ],
    "invalidateOn": {
      "targetContentChange": true,
      "detectorMajorChange": true
    }
  }
}
