{
  "kind": "scip-query-suppression",
  "suppressionIdentity": "SQD3DC2A53C210",
  "writer": {
    "tool": "scip-query",
    "version": "0.20.0"
  },
  "id": "SQD3DC2A53C210",
  "reason": "The source-token match is limited to generic console/error vocabulary; the renderers have different operations, result shapes, and user-visible contracts, so extraction would couple unrelated command semantics.",
  "createdAt": "2026-07-31T14:02:38.941Z",
  "schemaVersion": 2,
  "decision": {
    "kind": "automated-adjudication",
    "reasonCode": "detector-counterexample",
    "decidedBy": "agent",
    "policyVersion": 1,
    "observation": {
      "schemaVersion": 2,
      "observedAt": "2026-07-31T14:02:38.939Z",
      "facts": {
        "collaborationDomain": {
          "schemaVersion": 1,
          "canonicalizationVersion": 1,
          "hashAlgorithm": "sha256",
          "projection": {
            "name": "scip-query:collaboration-domain",
            "version": 1
          },
          "digest": "65fa7070a947c694f38de6708f2444d2bc2642785dcdb898d24a0401b41fb3c3"
        },
        "workspaceInstance": {
          "schemaVersion": 1,
          "canonicalizationVersion": 1,
          "hashAlgorithm": "sha256",
          "projection": {
            "name": "scip-query:workspace-instance",
            "version": 1
          },
          "digest": "f53b738aebdbca65df7f5d79a4bfc01cb854528c2a00705171682a625937c0c4"
        },
        "wholeContent": {
          "schemaVersion": 1,
          "canonicalizationVersion": 1,
          "hashAlgorithm": "sha256",
          "projection": {
            "name": "scip-query:repository-content",
            "version": 1
          },
          "digest": "900e8cb98874f1ece53d37f1192e2e46a07ef4fe9a0697a3268d3dc3511bdbdf"
        },
        "relevantInputs": [
          {
            "subject": "scip-query:index-inputs",
            "identity": {
              "schemaVersion": 1,
              "canonicalizationVersion": 1,
              "hashAlgorithm": "sha256",
              "projection": {
                "name": "scip-query:index-inputs",
                "version": 2
              },
              "digest": "42f5f059dcb75ae610efd0130117c7230835b2ace961ecbeb7afcef5c75bbb0b"
            }
          }
        ],
        "index": {
          "generation": {
            "schemaVersion": 1,
            "canonicalizationVersion": 1,
            "hashAlgorithm": "sha256",
            "projection": {
              "name": "scip-query:index-generation",
              "version": 1
            },
            "digest": "902fc98257e76e5cb0d33657c85f93730fdf59228738f7c5dea218627a63d861"
          },
          "inputs": {
            "schemaVersion": 1,
            "canonicalizationVersion": 1,
            "hashAlgorithm": "sha256",
            "projection": {
              "name": "scip-query:index-inputs",
              "version": 2
            },
            "digest": "42f5f059dcb75ae610efd0130117c7230835b2ace961ecbeb7afcef5c75bbb0b"
          },
          "source": "immutable"
        }
      },
      "observedSources": [
        {
          "kind": "index-generation",
          "identity": {
            "schemaVersion": 1,
            "canonicalizationVersion": 1,
            "hashAlgorithm": "sha256",
            "projection": {
              "name": "scip-query:index-generation",
              "version": 1
            },
            "digest": "902fc98257e76e5cb0d33657c85f93730fdf59228738f7c5dea218627a63d861"
          }
        },
        {
          "kind": "repository-snapshot",
          "identity": {
            "schemaVersion": 1,
            "canonicalizationVersion": 1,
            "hashAlgorithm": "sha256",
            "projection": {
              "name": "scip-query:repository-content",
              "version": 1
            },
            "digest": "900e8cb98874f1ece53d37f1192e2e46a07ef4fe9a0697a3268d3dc3511bdbdf"
          }
        }
      ],
      "stabilityProofs": [
        {
          "source": "index-generation",
          "kind": "immutable"
        },
        {
          "source": "repository-snapshot",
          "kind": "fixed-snapshot"
        }
      ],
      "diagnostics": {
        "clean": false,
        "headCommit": "7252bb0cf255be10d8dcef4d13d7e0a09e054c65",
        "treeOid": "b48e92a1ea40029764a146def20ed91a73332c2d"
      }
    },
    "evidence": [
      {
        "kind": "source",
        "referent": "src/runtime/commands/protected-work-authorization-handlers.ts",
        "claim": "The source-token match is limited to generic console/error vocabulary; the renderers have different operations, result shapes, and user-visible contracts, so extraction would couple unrelated command semantics.",
        "contentHash": "7c70f84b045a850d2ba111a76642c79822460d267e67cbbb11dd554141469dba"
      },
      {
        "kind": "source",
        "referent": "src/runtime/commands/mission-trial-handlers.ts",
        "claim": "The source-token match is limited to generic console/error vocabulary; the renderers have different operations, result shapes, and user-visible contracts, so extraction would couple unrelated command semantics.",
        "contentHash": "687add3132618ad09f0f0a514b26d6d87b618000975571c8e27dbb38ef6f8b5a"
      }
    ],
    "invalidateOn": {
      "targetContentChange": true,
      "detectorMajorChange": true
    }
  }
}
